key	nonce	ru
peoplepolicy	5	Сообщество обычно знает, чего оно хочет, но нельзя ожидать, что у участников будет время на изучение и голосование по каждому вопросу, поэтому следует делегировать это представителям, более экспертным участникам.
representation		Представители
representation	0	Я не хочу представительства, я хочу, чтобы каждый участник мог представлять свои интересы самостоятельно, без влияния администрации.
representation	1	Я хочу иметь лидеров, которые будут представлять интересы народа, даже если они лично с ним не согласны.
representation	2	Я хочу иметь лидеров, которые будут стремиться к приемлемому для всех решению, используя компромисс и другие методы, а не отстаивать мнение большинства, которое часто бывает в ущерб меньшинству.
representation	3	У нас должен быть один неизбираемый правитель, который представляет интересы народа от своего лица.
representation	4	Я не хочу представительства, представители мешают демократии, я хочу иметь возможность голосовать напрямую по большинству вопросов на референдумах.
representation	5	Интересы народа не должны быть представлены так сильно, как интересы администрации, или небольшой группы статусных участников.
equality		Равенство пользователей
equality	0	Определённые статусы наделяют участника различными привилегиями по сравнению с остальными пользователями. Хоть это и не делает его сильно главнее остальных, прав и возможностей у статусного участника должно быть больше.
equality	1	Бюрократ википроекта должен обладать самым высоким положением и иметь неограниченные права.
equality	2	Ни один административный статус не делает участника выше и главнее остальных. Это лишь инструмент, дающий доступ к определённым функциям википроекта. Задача администратора — думать не о своих правах, а об обязанностях перед участниками.
equality	3	Ни один пользователь не должен иметь власти над другим пользователем, хоть со статусами, хоть без.
openness		Открытость и прозрачность
openness	0	Деятельность администрации википроекта должна быть максимально прозрачной — не бывает ничего такого, что требовалось бы скрывать от обычных пользователей; любой участник должен видеть то, что обсуждают администраторы между собой касательно вики.
openness	1	Администрация вправе скрывать некоторую информацию, делать её недоступной для просмотра остальным. Обычные пользователи не должны знать всё.
openness	2	Более статусные участники могут иметь доступ к секретной информации администрации, но обычные пользователи не должны.
openness	3	Обычным пользователям не нужна абсолютно вся информация об администрации и вики, но администраторы должны быть открытыми и общительными перед народом, а также должны делиться с участниками результатами своей деятельности.
freespeech		Свобода слова
freespeech	0	Свобода слова — важнейшая концепция. Каждый участник должен иметь право говорить что угодно, даже если его речь может быть расценена другими как оскорбительная.
freespeech	1	Свобода слова должна быть ограничена — необходимо чистить и подвергать цензуре неприемлемые комментарии, содержащие, к примеру, очень грубые слова или неуместный рофл.
freespeech	2	Должны существовать определённые рамки, в которых участники могут свободно выражаться без упоминания некоторых нежелательных слов или тем.
freespeech	3	Свобода слова важна, участники должны иметь право выражать своё мнение в какой бы то ни было форме, но минимальные ограничения тоже нужны.
freespeech	4	Мы должны запретить и наказать очень оскорбительные выражения (язык вражды, хейтспич), выражающие ненависть к определённым группам людей и вызывающие дискриминацию, сексизм, гомофобию.
profanity		Мат
profanity	0	Обсценная лексика, включая мат, может спровоцировать конфликт между участниками, например, из-за оскорбительного содержания. Мы должны ограничить использование мата.
profanity	1	Мат неприемлем на википроектах, необходимо полностью запретить его употребление.
profanity	2	Участники должны иметь право употреблять в своей речи мат без каких-либо ограничений.
profanity	3	Люди должны иметь возможность писать матерные слова, но тем не менее, ограничения должны быть, чтобы комментарии не содержали один лишь мат.
profanity	4	Можно разрешить употреблять только определённые матерные слова в ограниченных количествах, и при условии, что участники будут их вуалировать.
etiquette		Этикет
etiquette	0	Необходимо регулировать общение и следить за тем, чтобы все пользователи на википроекте обязательно соблюдали этикет, общались прилично, выражались грамотно и ясно.
etiquette	1	В общем случае этикет нужен, но его не всегда обязательно соблюдать. Нет ничего плохого в том, если участник при общении использует много жаргонных или вульгарных слов.
etiquette	2	Этикет в большинстве случаев желательно соблюдать, в первую очередь для поддержания дружелюбной атмосферы, чтобы участники могли чувствовать себя комфортно и не быть оскорблёнными чьими-то грубыми словами.
etiquette	3	Мы не должны указывать участникам, как им общаться. Если участник хочет написать текст комментария в откровенном, фамильярном или пошлом тоне, это его право.
literacy		Грамотность и ошибки
literacy	0	Желательно, чтобы участники не коверкали слова слишком часто, хоть в этом и ничего плохого нет. Людям необходимо хорошо понимать друг друга, чтобы не возникало недопониманий из-за ошибок в тексте.
literacy	1	Если людям нравится эрратив, и они хотят намеренно коверкать слова или писать их с ошибками, то в этом ничего плохого нет.
literacy	2	Грамотность важна, нужно следить за ней, но в редких случаях, если участники хотят намеренно писать слова с ошибками, можно им это позволить.
literacy	3	Необходимо ввести стандарты, согласно которым все участники должны будут писать грамотно и без ошибок, чтобы комментарии было приятно и комфортно читать.
vulgarity		Непристойность и пошлость
vulgarity	0	Мы должны регулировать распространение эротических и непристойных материалов, но не запрещать их. Участники должны иметь право ими делиться.
vulgarity	1	Непристойный контент должен быть очень сильно ограничен. Мы можем позволить публиковать его очень редко в незначительных количествах, но не запрещать его полностью.
vulgarity	2	Непристойность, пошлость, содержимое эротического характера категорически неприемлемы. Необходимо строго следить за подобным контентом и, в случае чего, незамедлительно его удалять.
vulgarity	3	У людей должна быть свобода на распространение контента любого содержания, включая эротику и пошлость.
vulgarity	4	Суровое притеснение непристойных материалов обычно лишь способствует распространению цензурируемого. Участникам должно быть позволено делиться эротическим и пошлым контентом, при условии, что они будут зацензурены.
banter		Стёб, троллинг и шутки
banter	0	Троллинг необходимо ограничить, но стёб и шутки можно разрешить, если они уместны и не вызывают раздражения у окружающих.
banter	1	Если участникам нравятся шутки друг над другом и дружеский стёб, то в этом ничего плохого нет, люди вольны общаться так, как им нравится.
banter	2	Любой троллинг, стёб и неуместные шутки должны быть строго запрещены. Нам не нужны лишние конфликты на пустом месте, поэтому необходимо контролировать то, что пишут участники.
banter	3	Троллинг и неуместный стёб могут оскорбить участников, заставить их почувствовать себя ничтожными и разжечь конфликт. Мы должны наказывать троллей, а жертвам троллинга оказывать поддержку, чтобы уберечь их от виктимблейминга.
rules		Список правил
rules	0	У нас свободное сообщество, нам не нужны правила поведения. Участники могут вести себя так, как они хотят, пока их поведение устраивает остальных.
rules	1	Правила на википроекте должны быть строгими, а сам список следует сделать максимально подробным, без размытых формулировок, чтобы участники в полной степени точно знали, что делать недопустимо, и не смогли найти никакие «дырки» в правилах.
rules	2	Список правил должен быть не слишком строгим, умеренным по размеру. Он должен содержать основные положения касательно принципов поведения, но без лишних подробностей.
rules	3	Лучше не делать список правил википроекта излишне длинным и подробным — это лишь напугает участников и оттолкнёт их читать правила. Лучше сделать небольшой, короткий, но дружелюбный, понятный и доступный для всех список правил, не содержащий канцелярита.
rules	4	Вместо списка правил, мы должны просто написать, что наш википроект придерживается правил морального устоя. Участники сами понимают, как нельзя себя вести в общественных местах и нормальном обществе, им не нужно объяснять очевидные вещи.
rules	5	У нас не должно быть правил поведения, администрация должна иметь возможность блокировать и мутить участников по своему желанию.
blocking		Срок банов
blocking	0	Для поддержания порядка достаточно мягких мер наказания, мы должны снисходительнее относиться к нарушителям. Блокировка от пары часов до нескольких дней — оптимальный срок в большинстве случаев.
blocking	1	Для сдерживания пользователей от будущих нарушений мы должны поддерживать надлежащий уровень порядка. Мы должны начать с малых сроков в отношении нарушителей, но при каждом следующем нарушении необходимо увеличивать длительность блокировки.
blocking	2	Не стоит жалеть нарушителей. Если участник нарушил правила, то он заслуживает сурового наказания. В среднем, достаточно блокировки на несколько дней, но для особых случаев — от нескольких недель до месяца и более.
blocking	3	Не должно быть единых мер касательно блокировок, участники сообща могут решить, какой срок дать нарушителю в конкретном случае, например, посредством голосования.
blocking	4	Срок бана зависит прежде всего от тяжести нарушения, и в каждом отдельно взятом случае может сильно варьироваться. В среднем, блокировка от пары дней до недели — приемлемый срок.
permanent		Перманентный бан
permanent	0	Не стоит брезговать перманентным баном. Если участник получил его, значит, он это заслужил. Мы не должны больше иметь с ним никаких дел, и уж тем более, не должны разблокировать его, никогда.
permanent	1	Мы не должны применять перманентный бан в отношении нарушителей, в нём нет смысла — если нарушитель захочет, он может создать дополнительный аккаунт и обойти перманентную блокировку.
permanent	2	Участники должны самостоятельно решать в конкретных случаях, использовать ли перманентную блокировку к нарушителю, либо нет. То же касается и разбана.
permanent	3	Перманентная блокировка не должна использоваться слишком часто, но она может послужить хорошим инструментом для сдерживания пользователей от дальнейших нарушений.
permanent	4	Мы должны использовать перманентную блокировку очень редко, а также уметь прощать перманентно забаненных участников, посредством разбана и реинтеграции их в общество спустя определённое количество времени после блокировки.
recidivism		Рецидив нарушений
recidivism	0	За нарушителями-рецидивистами необходимо вести более строгий надзор и контроль, чтобы предотвратить дальнейшие нарушения. Чем больше раз участник нарушал правила, тем суровее должны быть условия блокировки для него..
recidivism	1	Если участник неоднократно плохо себя ведёт, но в целом не вызывает неприязни у остальных, то ничего страшного нет. Если же нарушитель своим поведением всех окружающих изрядно достал, то участники могут пожаловаться на него.
recidivism	2	Любой участник, какой бы проступок он не совершил, заслуживает прощения и второго шанса. Мы должны давать нарушителям-рецидивистам возможность извиняться за свои проступки и исправляться.
recidivism	3	С теми, кто нарушал правила неоднократно, бесполезно пытаться найти общий язык. Рецидивистов — в перманентную блокировку.
recidivism	4	Неважно, сколько раз нарушал правила участник, важна тяжесть его нарушения в каждом отдельно взятом случае. Если нарушения повторяются, достаточно снова просто выдать временный бан или мут.
offender		Что делать с нарушителем
offender	0	Если участник получил бан, администрация обязана поговорить с ним, обсудить произошедшее, попытаться заставить нарушителя понять, почему он не должен делать то, что сделал, и почему он был наказан.
offender	1	Если участнику была выдана блокировка, то нарушитель должен иметь возможность поговорить с администрацией по этому поводу. Но администраторам не стоит начинать разговор с нарушителем первыми.
offender	2	Если участники захотят этого, они могут предоставить нарушителю слово, чтобы он мог поговорить с ними во время блокировки.
offender	3	Стоит лишить нарушителя дополнительных возможностей и, если нужно, убрать возможность связаться с администрацией. Администраторам не нужно тратить своё время на тех, кто плохо себя ведёт. С такими людьми не о чем разговаривать.
offender	4	От нарушителя стоит ожидать, что он дождётся конца срока бана и переосмыслит своё поведение. Также общественное знание о блокировке участника будет иметь сдерживающий эффект — это послужит примером для остальных, которому не стоит следовать.
warnings		Предупреждения
warnings	0	Зачастую банить нарушителей можно и без предварительной выдачи им предупреждений. Участники должны знать правила поведения заранее, и быть готовы к тому, что если они не будут им следовать, то их будут ждать суровые последствия.
warnings	1	Мы не имеем право блокировать участника до тех пор, пока не исчерпаны другие способы его убеждения в недопустимости плохого поведения. Мы можем давать ему предупреждения, но лучше постараться переубедить его словами.
warnings	2	Предупреждение — хорошее средство уведомить участника, что он плохо себя ведёт. Во многих случаях можно выдавать участнику несколько предупреждений, и только если он не понимает, что так вести себя не стоит, то тогда уже выдавать блокировку.
warnings	3	В первый раз при нарушении можно выдать участнику предупреждение, а во всех последующих случаях — только блокировки.
ambiguity		Неясность нарушения
ambiguity	0	Если участник «ходит по тонкому льду», необходимо пристальнее следить за ним, дожидаясь малейшего повода, когда он перешагнёт черту, чтобы заблокировать его, предотвратив потенциальные дальнейшие нарушения.
ambiguity	1	Участнику, по поведению которого видно, что он потенциально опасен и может натворить много вреда для общества, лучше превентивно выдать блокировку, чем допускать риск совершения им преступлений.
ambiguity	2	Если участник странно себя ведёт, необходимо поговорить с ним, попытаться понять, что у него случилось. При этом с большей вероятностью удастся добиться положительного исхода событий, без блокировок.
ambiguity	3	Участника можно блокировать лишь в том случае, если будет доказано, что он нарушил правила. А до тех пор, пока прямых доказательств его вины нет, участника можно считать невиновным.
