key	nonce	ru
ambiguity	4	Если поведение участника выглядит неадекватным для большинства других пользователей, то в таком случае они могут на него пожаловаться, чтобы тот получил блокировку. Если же поведение участника не вызывает неприязни у большинства, то ничего страшного нет.
friendship		Викидружба
friendship	0	Сотрудничество с участниками ради общих интересов — важнейший компонент развития взаимоотношений и существования вики. Я полностью поддерживаю дружбу.
friendship	1	Мы можем заключить дружбу с другими вики, чтобы расширить влияние нашего википроекта, что поможет нам продвигать наши собственные идеи.
friendship	2	Мы должны закрыться от внешнего мира и сконцентрироваться целиком только на наших собственных проблемах.
friendship	3	Я не вижу причин для заключения дружественных отношений, вряд ли они чем-то сильно нам помогут. Мы можем работать над нашими проблемами и вопросами самостоятельно.
uniformrules		Межвикийные правила
uniformrules	0	Совместное использование правил с другими вики повышает популярность нашего википроекта и придаёт ему больший вес на площадке Фэндома в различных вопросах, поэтому я поддерживаю эту идею.
uniformrules	1	Я поддерживаю совместное использование единых правил с нашими дружественными вики, так как это упростит жизнь всем участникам и облегчит поддержание порядка.
uniformrules	2	Я против совместного использования правил с другими википроектами. Мы должны иметь возможность принимать решения о своих правилах самостоятельно, и другие википроекты не должны иметь на это права.
uniformrules	3	Возможность использовать правила нашего википроекта, когда нам нужно продвигать собственные интересы, имеет бóльшую ценность для нашей вики, чем преимущества общих правил.
wikihelp		Помощь википроектам
wikihelp	0	Мы должны расширять наше влияние во внешней политике Фэндома, и помощь википроектам — это хороший способ завоевать расположение и популярность.
wikihelp	1	Мы должны вмешаться в дела других википроектов с той целью, чтобы установить там свой подконтрольный режим, расширив наше влияние.
wikihelp	2	Наша помощь википроектам может значительно улучшить их качество и помочь развиться сообществу за относительно небольшой труд для нас, поэтому мы должны им помогать.
wikihelp	3	Мы не должны тратить своё время и силы на другие википроекты.
wikihelp	4	Дела других википроектов не имеют для нас значения, поэтому нет причин им помогать.
instructions		Указания других википроектов
instructions	0	Мы не должны менять свои правила, потому что так говорят другие википроекты.
instructions	1	Мы должны принимать во внимание указания и советы других википроектов и учитывать свои ошибки. Если нас о чём-то просят, мы должны прислушиваться к просьбам других людей.
instructions	2	Правила нашего википроекта не должны определяться участниками с других вики, мы можем рассматривать их указания, но должны принимать их только в том случае, если они соответствуют нашим интересам.
instructions	3	Мы должны пытаться использовать эти указания в своих интересах: поддерживать те, которые выгодны нам, и поощрять других следовать им, однако мы сами должны следовать только тем указаниям, которые выгодны нам.
wikiunion		Предложение вступить в викисоюз
wikiunion	0	Я за вступление в этот викисоюз. Сотрудничество с википроектами поможет нам в организации совместной работы и помощи друг другу, что позволит объединить аудиторию и принесёт в конечном итоге пользу всем участникам наших вики.
wikiunion	1	Я поддерживаю сотрудничество с участниками с других википроектов, и ценю их предложение о викисоюзе, но не думаю, что этот союз будет настолько полезен. Нам достаточно простых дружественных отношений.
wikiunion	2	Я против того, чтобы быть частью любого союза. Меня не интересуют правила других википроектов, но я категорически против того, чтобы давать им право голоса в наших делах.
wikiunion	3	Наши вопросы должны решать мы сами, а не участники с других википроектов. Я против участия в этом союзе.
wikiunion	4	Участие в этом викисоюзе даёт нашему википроекту гораздо большее влияние в межвикийных делах, что может помочь нам в продвижении наших собственных интересов и установления тех правил, которые мы лично хотим. Поэтому я поддерживаю членство в этом союзе.
A		Выберите вариант, который вам ближе всего
BL		Нажмите ?, если предпочтение незначительное
BR		Нажмите ✓, если это определённо ваше предпочтение
all		Все
home		Главная страница
values		Возможные значения
